codice,progetto,istituzione
202223c3X9,"The Angevin World, the Papacy and the East: 1250-1450",Università degli Studi di NAPOLI L'Orientale
202223c8Z4,The Germanic Reception of Lanfrancs of Milan Chirurgia magna: Critical Editionand Terminological Commentary of the English and German Branches of the Tradition,Università degli studi di GENOVA
202224MEMK,De rerum figura. Things inside Images in pre-Roman Italy DRF,Università degli studi di PAVIA
20222NFMAH,Folklore and oral traditions in the Greek culture. From the Archaic to theHellenistic period.,Università degli studi di NAPOLL'Orientale
20222RJE32,"SCORPiò-NIDI. Comparative Analysis and Certified Reconstructions for a correctexperimental archeology: Roman Scorpions and Ballistae for the Imperial mechanical culture,origin of European identity. Governance policy for the development and sustainable fruition ofCultural Heritage.",Università degli studi della Campania Luigi Vanvitelli
20222zRMFZ,"Islamic Literatures in Sub-Saharan Africa: Themes, Genres and Publics",Università degli studi di NAPOLIL'Orientale
202232Y8YA,DT^2 - The Recovery Demand and the Educational Supply: A Design Toolkit forDesign Teaching,Università degli studi di Napoli Federico II
20223H7759,Literary translation and cultural transfer between Italy and Romania: creation ofa bilingual digital archive of literary translations from Italian into Romanian and from Romanianinto Italian,Università degli Studi di PADOVA
20223HNTT8,LeGeRe LEI Germanismi Reloaded,Università degli studi di NAPOLI L'Orientale
20223LE4AB,"Towards a technical history of early modern Italian wooden sculpture: a digital database of diagnostic and historical investigations (significant case examples from Florence,Lazio, Naples and Southern Italy).",Università degli studi di ROMA Tor Vergata
20223NMEP4,Building Civic Identities. Towards an Atlas of Communal Palaces in Italian UrbanHistory (12th-20th Centuries),Università degli studi di GENOVA
20223NMRBC,"Italian Instrumental Music 1750-1850: Contexts, Practices, Imaginaries",Università degli Studi ROMATRE
202242Ms2F,Re-Visualizing the West: geo-literary images of Europe in contemporarySinophone writings,Università degli studi di MILANO
20224BPEXZ,"Next Generation Ita. Increasing Trust, Making Future Generations Possible",Università degli studi di TORINO
20224K2JA8,HYPERsTAGE: an Open Knowledge base for the semantic reconstruction of theatrical performances through the harvesting and processing resources from the New ItalianNetwork of theatrical digital archives.,Università degli studi di ROMA Tor Vergata
20224KFTLP,Hegelian constelltions of the feminine: a hyper-archive for an inclusive Bildung.,Università degli Studi ROMATRE
20224MFWHC,Habits in (Time of) Crisis (HiToC). Conceptual Tools for Dealing with DisruptiveEvents,Università degli Studi ROMATRE
20224WA39R,TeLPhTeaching and Learning Philosophy in the Regnum Italiae (1250-1450): from Exception toEuropean Heritage,Università degli studi di ROMA Tor Vergata
2022582NRJ,A Model of Digital Commentary for Twentieth-Century Literature. The Case ofCarlo Emilio Gaddas LAdalgisa. Disegni milanesi,Università per Stranieri di SIENA
2022594MAA,Applied Shakespeare: Developing New Educational Models for TransversalCompetences and Life-skills,Università degli Studi ROMATRE
20225E9XZM,"A Question of Honor: Duels in Italian Culture from the Risorgimento to the FascistPeriod, between Imaginary, Representation, and Reality",Università degli Studi di FIRENZE
20225KT494,The Primo Levi Thesaurus: The Genesis and Dissemination of a Twentieth-CenturyCorpus,Università degli studi di PAVIA
20225LFCMZ,"Itineraries of Philosophy and Science from Baghdad to Florence: Albert the Great,his Sources and his Legacies",Scuola IMT Alti Studi -LUCCA
20225REWBB,"PLanETsProduction Landscapes through Energy Transitions: Industrial heritage preservation, socio-political processes and potential reuse in Lombardy, Sardinia, and Calabria",Università degli studi di CAGLIARI
202273E9F4,EByRome. Epigraphy of Byzantine Rome: medieval Greek inscriptions from/inRome and Latium (6th-15th cent. AD),Università degli studi di ROMA Tor Vergata
202279SXRM,PatriarX: PAths of the TRansmlssion of SAint CyRils LeXicon,Università degli studi di MESSINA
20227AF8Y3,"Narration and care.The deinstitutionalization of asylum system in Italy: history, cultural imaginary, planning (from1961 to today)",Università degli studi di CAGLIARI
20227CHRR2,MEDITA - Medieval Latin documentation and Digital Italo-Romance Lexicography. Integrated Resources for the New Historical and Etymological Lexicography,Università degli studi di Napoli Federico II
20227KsKN5,A Physical Geography of German-speaking Literature,Università degli Studi di ROMA La Sapienza
20227M8Rs7,The ATLAS of talian Digital Humanities: a dynamic knowledge graph of digitalscholarly research on Italian Cultural Heritage,Università degli studi di BOLOGNA
202283FJF7,"Texts of Uncertain Authorship in Thirteenth-century Italian Lyric Poetry. Methods,Practices and Tools of Attributive Philology.",Università degli studi di ROMA Tor Vergata
202285zT47,Identity Heritage and Cultural Memory. The elaboration of the past through thetheatre of democratic Spain (1975 to the present),Università degli studi di TORINO
202288K2BX,202288K2BX -I_PAD Italian Performance Archive in Digital.Mapping and Dissemination of the Iconographic and Audiovisual Heritage of Italian MediaPerformance: Giacomo Verdes Archive.,Università degli studi di MILANO
20228APAFR,ESCAPES: Experimental Sustainable & Collective Architectural Places forEmployes-Carers,Università degli studi di MILANO
20228BA393,TRAFFIC - Tracing American and Foreign Funds in Italian Cinema (1945-1962),Università degli studi di BOLOGNA
20228CJRLK,CLIO. Corpora for Italian Lyric of the Origins,Università per Stranieri di SIENA
20228JHK5L,CHIARA Cultural Heritage Innovation Adopting Risk AssessmentAdvanced procedures for the enhancement of nationwide built heritage (positioned in isolatedand/or peripheral locations),Università degli Studi di BOLOGNA
20228MHXCM,PAVES-eTowards an Archive-Edition of Paveses Work,Università degli studi di CATANIA
20228MRWL2,Cinephemera. Ephemeral materials for the study of Italian cinema between the1930s and 1960s,Università degli studi di UDINE
20228P3LYC,"The art of the stage in Bronze Age Anatolia. Reconstructing Hitite festivals usingtexts, images and comparative cultural anthropological evidence",Università degli studi di NAPOLI L'Orientale
20228TEZ9T,The forms of the museum: pilot project for a digital atlas of talian museums,Università degli studi di Napoli Federico II
20228X5F3E,LALALEXiT. Late Latin Lexicon in Transition,Università Ca' FoscariVENEZIA
20228Z4LX3,CoenoBl(u)M. Art and architecture of the Cassinese Benedictine Congregation (XV-×XVIll centuries): digital and spatial analysis strategies through BiM models.,Università degli studi di PADOVA
20228Z92FK,Obscene Freedom. Libertinism and Radical Enlightenment in ContemporaryFiction and Imagery,Università degli studi di PADOVA
20228sERKN,Laugh Tracks. Greek Comedy in Ptolemaic Egypt,Università degli studi di GENOVA
202297ATKC,spaNice: Spanish cultural models in Early Modern Venice (the development and circulation of Spanish literature and language in 16th-17th century taly),Università degli studi di VERONA
2022987EAH,"BorderArt(E)Scapes. Contemporary Art, Anthropology and Borderscapes: from the late nineteenth century to the 2ooos, reading contemporaneity and experimenting with newresearch practices",Università degli Studi di FIRENZE
20229AWNX2,"Atlas of Antagonist Discography: taly, 1958-1980",Università degli studi di TORINO
20229B57sX,Circulating Populist Sentiments in 21st Century Film and TV Fiction in Italy,Università degli studi di Urbino Carlo Bo
20229E83B3,Resilient Septuagint.,Università degli studi di BOLOGNA
20229LLFK2,Women in the History Philosophy,Università della  CALABRIA
20229MY34B,TransLATINg Italian Literature,Università degli studi di ROMA La Sapienza
20229RTTBJ,Borrowing a boat to go out on the oceanThe image of China as a cultural power promoted by the PRC Governments strategies and Italianborn Chinese,Università degli studi di TORINO
20229YEcPs,Petronius and Apuleius: new critical editions and related studies,Università degli studi di FIRENZE
2022A2LXSP,"IDEA | THE DIGITAL ZUCCARI CORPUS. Texts, Contexts, Sources and Lexicon",Università degli studi di TORINO
2022A5FHFY,French phenomenology today,Università degli studi di SASSARI
2022A773E4,Peripheral Baroque Sculpture 1630-1750: knowledge and engagement.Census and Digital Atlas of the Lazio provinces and the border areas,Università degli studi di FIRENZE
2022A97cER,The reception of Vico and the early twentieth century In Italy: a Digital Exhibition,Università degli studi di BOLOGNA
2022A9TNXX,FilmBaseMatters: A Material Approach to the History of Small-_gauge Film in Italy,Università degli studi di UDINE
2022AETLCK,Italy outside Italy Italian intellectual migration and the emergence of a modernEuropean identity,Università di  PISA
2022AHREBP,"ARIANNAAn interoperable platform for aRchaeologlcAl sites: conservatioN, eNvironmental design andwider Accessibility after covid.",Università degli studi di Napoli Federico II
2022ANJWAZ,"Light prefabrication: knowledge, monitoring and requalification of thearchitectural heritage of the second half of the twentieth century in the regions of Calabria andLazio",Università della  CALABRIA
2022ARJYES,"A NEW OPEN ACCESS CRITICAL EDITION OF DANTES COMMEDIA FOSTERINGDIGITAL HUMANITIES PROJECTS. COLLATION OF 580 MSS, PROVISIONAL TEXTS ANDAPPARATUSES, AND LEXICAL UPDATINGS TO THE VOCABOLARIODANTESCO (AcCADEMIA DELLA CRUSCA/ CNR)",Università degli Studi di FERRARA
2022AsYE4K,Actresses and actors writing between Italy and Europe: art and memory,Università degli Studi di MILANO
2022B2EXJP,External vs Internal Objects of Knowledge in the Late Middle Ages: from DirectRealism to Representationalism,Università degli studidel'AQUILA
2022BAYPL5,Venezia Libro Aperto (acronym: VeLA),Università Ca' FoscariVENEZIA
2022BBPB8N,"Ancient Science, Ancient Philosophy (the ASAP Project). The PhilosophicalFoundation of Sciences",Università degli studi di TORINO
2022BE7TAT,"FALSVM - Forging Authorship in Literature, Scholarship, and Visual MediaPhase 1: Classical Antiquity",Università degli studi di TRENTO
2022BPCP8N,The Transmission of Old Church Slavonic Texts,Università Ca' FoscariVENEZIA
2022BsMkx8,Romes defensive systems between past and present.The heritage-recognition process of the Aurelian Walls and of the military Forts (19th-21stcenturies),Università degli Studi ROMATRE
2022CA8BW3,MERMAID - MEdieval Romance Miscellanies As Instructional Devices,Università degli studi di MILANO
2022CEJ348,AMATI Vi(H)olinAdvanced Multimodal Analysis based on noninvasive fullield physics Techniques for InnovativeViolins Holistic inspection,Università degli studi di VERONA
2022CHASRE,Radical Exhibited ThoughtExhibitions of Architecture in Italy in the Contemporary Age,Università degli studi di BOLOGNA
2022CW8EYT,ArDiTeHis (Digital Archive of Spanish Text) and the digital editions of certainSpanish texts from the XVI to the XiX centuries,Università degli studi di CATANIA
2022EAZH78,TRAMED. Edition and Translation of Latin Medical Works of Late Antiquity.,Università degli studi di PERUGIA
2022EHZFWB,"COLERE HEREDITATEM BETWEEN PEACE, CONFLICTS AND GLOBAL CHANGE. A NEW AND OLD CHALLENGE FOR EUROPE",Università degli studi di BOLOGNA
2022EK7p7F,The CLALI project: a corpus for studying the language of autographs of Italianwriters (1450-1550).,Università degli studi di ROMA La Sapienza
2022EZ7WMW,"The British Wave: The Impact of British Views of Human Nature, Morality, andReligion on 18th-Century German Philosophy",Università degli studi di MILANO
2022F38ZB3,DIgital twin and Modern HEritage modelliNg towards Sustainable InfOrmedmaNagement - DIMHENSION,Università degli studi di ROMA La Sapienza
2022FENML2,"Theories, Philosophies and Politics of Bodies in Network-Connected DigitalUniverses",Università degli studi di BARI ALDO MORO
2022FJ22CF,Medieval Churches: Building Site Practices in a Comparative Perspective,Università degli studi di PADOVA
2022FK9THF,"PolEmA - Polycentric Empires in Western AsiaConnectivity, texts and settlements from Ctesiphon to Afrasiyab and beyond.",Università degli Studi di ROMA La Sapienza
2022FL299Z,Universal Latin Chronicles in Medieval taly (1183-1340): Evolutions and Networksbetween Traditional Models and (Pre-)Humanistic Experiments,Università degli studi di MILANO
2022FL4775,Philosophical Reviews in German Territories (1668-1799),Università Ca' FoscariVENEZIA
2022FLT28B,A direction in transition. A study of directing processes in Italy starting from the1990s. Digital cataloging of documentary material and historical and critical analysis.,Università degli studi di NAPOLI L'Orientale
2022FNR3ZJ,Digital Bandello: Scholarly Edition and Commentaries.,Università degli studi di MODENA e REGGIO EMILIA
2022Fjx9YZ,"Chinese narratives and the narration of China in Iltaly: literature, cinema and art at the intersection of cultural diplomacy and cultural industry",Università Ca' FoscariVENEZIA
2022H3X748,"Understanding Natural History: Nature, Evolution and Human Beings. A NewPhilosophical Framework",Università degli studi di PADOVA
2022H82FCX,Greece in Italy: Cultural Intersections from the 1821 Greek Revolution to theEconomic Crisis of the 2010s,Università degli studi di ROMA La Sapienza
2022H88MAC,"Lterature and Sciences in the Nuova tali (1848-1915): Psychology,Anthropology, Medicine.",Università degli studi di GENOVA
2022H8sz92,Between Text and Performance: Race and Gender in Anglophone Literatures andCultures (1970s-today),Università degli Studi ROMATRE
2022HE32C5,DAEL - Digital Archive of Eighteenth-century Letters,Università degli studi di PADOVA
2022HE8ZHs,"Detached frescoes, conservation and museum setings. Historical research, non- invasive diagnostic and Digital Heritage for a new inclusive Museology.",Università degli Studi di VERONA
2022HHBXF8,"DIS-AR-MER*-Drawings of Architecture ) in Southern Italy (15th -18th century)*The acronym, derived from the Italian title (DIsegni di ARchitettura nel MERidione), prefiguresthe intent to defuse (disarm) the commonplace of cultural delay in Ssouthern Italy and of thesimple local acceptance of models which had been elaborated elsewhere",Università degli Studi di PALERMO
2022HJW23K,RETI REndering Texts and Images. Digital Scholarly Editions with EditionVisualization Technology,Università di  PISA
2022HNTcXS,"Aeschylean Tragedy: Text, hypotexts, performance",Università di  PISA
2022HT3xYP,"Chivalric Spaces. A digital landscape of texts, stories and narrative motifs ofprinted popular chivalric literature in Italy and Spain",Università degli studi di ROMA La Sapienza
2022HTJ7MN,FILMUSP – Music Publishing and Film: Toward a Production History of theSoundtrack in Italy (1958-1976),Università degli Studi di MILANO
2022HYE33P,Cultural Communities and Seventeenth-Century Books of Verse: The ItalianContext,Università degli studi di BERGAMO
2022HYsFNR,The Crossmodal Congruence Toolkit: a Behavioural Neuroscience Framework forSpatial Design,Università degli Studi di PARMA
2022HZPCL9,DAISI. Anastilosi digitale e interpretazione interativa degli spazi: nuovemetodologie per la storia delarte.Tre laboratori esemplari sulle chiese mendicanti italiane tardo-medievali (secc. Xll-XV).DAISI.Digital Anastylosis and Interactive Spatial Interpretation: new methods for Art History.Exemplary case studies of Italian late medieval mendicant architecture (Xl-XV centuries).,Università degli Studi di FIRENZE
2022J4ER9X,A Pilot Project in the Digitisation of Epigraphic Manuscripts (ProDEM): Senator Filipo Buonarrots Papers and Antiquarian Culture under the Last Medicis,Università degli studi di FIRENZE
2022J52TZY,The Mediterranean through Chinese Eyes: An Analysis Based on Geographical andTravel Sources from the Song to Qing Dynasties (960-1911),Università degli studi di PALERMO
2022JCYBXM,"INFORTREAT. Reconstructing the Early Modern bastioned front. INformationmodels for the fruition of constructive knowledge in FORtified architecture TREATises (16th-18thCentury): a new integrated analysis tool for the interpretation, restoration and maintenance ofEarly Modern fortified heritage.",Università di  PISA
2022JELMNK,1920-2020: Phantasmagories of war in contemporary literary experiences,Università degli studi di PALERMO
2022JF8PL,The return to painting and the persistence of the image.The New Italian Way,Università degli studi di FERRARA
2022JM4H92,Plurilingualism in Hitite Anatolia: the case of the Hurrian and Hattic traditionbetween reception and translation.,Università degli studi di PAVIA
2022JMBc38,"VeLoCi- The Vesuvian Lost Cities before the “Discovery. Sources, Experience, Imagery in Early Modern Period",Università degli studi della Campania Luigi Vanvitelli
2022JMJLc2,Italian Cinema in light of new sources from the Vatican Archives on the Pontificateof Pius XIl (1939-1958): Strategies of Communication between silence and Public Rhetoric fromthe World War to the Cold War,Università degli Studi di MILANO
2022JPNKZ4,SPLASCH | Smart PLatform and Applications for Southern Cultural Heritage,Università degli Studi di Napoli Federico II
2022JR8z8P,Social Transformations and the Crisis of Expertise,Università degli studi di TORINO
2022JRXA9L,Hidden in plain sight: gold and silver altarpieces in medieval Venetia,Università Commerciale Luigi Bocconi' MILANO
2022JYMWMs,"MIsERABILIA: Spaces and Specters of Misery. Epicenter of Studies, Research,Theories and Projects for the Development of an Image and a Reality for the ContemporaryItalian City",Università IUAV di  VENEZIA
2022K4CP7C,Deconstructing Lombard Identity. For a new Vision of Romanesque Sculpture in the North Italian Context,Università degli studi di PAVIA
2022KHWYLM,"Sport Politics: Football, Media, and National Identity in Italy (1968-2006)",Università degli Sstudi di ROMA La Sapienza
2022KPWZFL,"Cinema and the LGBTQ+ movements, from the first traces to institutionalization(1945-1989)",Università degli Studi di MILANO
2022KSNJ4,Petrarch online: New Perspectives,Università Cattolica delSacro Cuore
2022KWLTWA,Digital Leopardian Letters (EDiLe),Università degli studi di MACERATA
2022KZFEKX,Dante in the contemporaneity. Theatrical rewritings,Università degli studi di TORINO
2022L547TR,"Epic writing and Tassos Library. Cultural spaces, critical perspectives and digitalenvironments.",Università degli studi di PADOVA
2022LB2FNL,An idle question? Rethinking and commenting on early nineteenth-centuryLiterature,Università degli studi di ROMA La Sapienza
2022LB5YW4,"Bodies, ecology and moving identities: towards a partnership paradigm(Acronim: BEAM)",Università degli studi di UDINE
2022LB835Y,"MOV..E. - Moving Images Exhibitions. Film museums, audiovisual heritage:historical perspectives, strategies of enhancement and contemporary ecosystems",Università degli studi di CATANIA
2022LF72JW,"VENUSIA JUDAICA: ADVANCED TOOLS FOR EPIGRAPHICAL, ARCHAEOLOGICAL,GEOMINERALOGICAL INVESTIGATION, SUSTAINABLE FRUITION AND PRESERVATION OF THEJEWISH CATACOMBS OF VENOSA",Università degli studi di NAPOLL'Orientale
2022LFR494,The technological mediation of the Human. Faces and gestures in the forms ofdigital self-representation.,Università degli studi di PAVIA
2022LHskKR,"Transmission of performing knowledge in Italian theatre culture. History, theoryand practices",Università degli studi di ROMA La Sapienza
2022M3FK9C,"Reviving The Liberal: Literature and Poliics between Britain and Italy, 1821-23",Università degli studi di PARMA
2022M92E5J,"Monsters, Sorcerers, and Witches of Northwestern Europe: The Medieval and Early Modern Construction of Otherness in Literature for Popular Audiences",Università degli studi di SIENA
2022MAAYRT,Populist landmarks between theory and history. Hegemony and regimes oftruth as keys to determining the epistemic relevance of populisms,Università degli studi di Urbino Carlo Bo
2022MKPF9Y,The Paradigm Shift in the Modern Understanding of Freedom,Università degli studi di FERRARA
2022ML3N9,"Transmediality: media, science, genres, arts in Panhispanic poetry (1980-2022)",Università degli Studi di PADOVA
2022MMPYF4,Reception and Transmission of Greek Texts from Byzantium to the Renaissance:Towards a Repertorium of the Greek Scribes in the Italian Libraries (RCG-Italia),Università degli studi di MILANO
2022MPsE2P,"Literary California 1884-2022: Spaces of Exception, Spaces of Disaster",Università Ca' FoscariVENEZIA
2022MRWN2K,Movement Experience Through Rhythmic Organization in AudiovisualRepresentational Texts (METRO_ART),Università Cattolica delSacro Cuore
2022MS47sC,"LiMINA - Lost in Manuscripts. Ideas, Notes, Acknowledgments",Università degli studi della Campania Luigi Vanvitelli
2022MYMsLK,Female voices in a public context: authorial articulation and mimeticrepresentation in ancient Greek literature,Università degli Studi di Napoli Federico II
2022N2WTM4,The neo-Kantian reception of Schiller between Platonism and Kantianism(neokasch),Università degli studi di Napoli Federico II
2022NE2LWP,"ParaText – Refining methods, tuning tools, enhancing book heritage for the studyof the relationship between text and exegesis in manuscripts of ancient Greek poetry.",Università degli studi di PAVIA
2022NSAXYP,RE3WORK - REsilient REtrofitting and REuse of Water heritage and builtenvironments: multi-objective Optimization for RisK mitigation and cultural enhancement,Università degli studi di ROMA La Sapienza
2022NW5BcC,Ancient and modern tools for the transmission of linguistic knowledge: thetradition of Latin grammar,Università degli studi di VERONA
2022NZRBRH,The Wheel of Time: An Inquiry into New Sources of Late Indian Buddhism (X-Il ent.),Università degli studi di NAPOLI L'Orientale
2022Nss7AK,Classica Serica. The language and literary characteristics of East Asian Latin and the impact of classical texts on Latin Texts of Eastern Asia between Medieval and Early ModernAge,Università degli studi di TORINO
2022P5FA2H,Ariostos library. For a new commentary on 1532 Orlando furioso,Università degli studi di FERRARA
2022P749MT,"Performing arts, economics, and cultural policies. New interpretative paradigmsbetween aesthetics and social sciences",Università degli studi di BOLOGNA
2022PCN7BY,"Scholars at War Digital Library: an Innovative Environment for AdvancedDocument Management.Philology, Politics, Society, from the Franco-Prussian War (1870) to the fall of the Berlin Wall(1989) and Beyond",Università degli studi di CATANIA
2022PEA4ZK,"Reframing Italian Film Festivals: Histories, Politics, Cultures (RIFF)",Università degli studi di BARI ALDO MORO
2022PEL788,"The Galleria Borghese and its Public(s), 1888-1938",Scuola Normale Superioredi PISA
2022PPRLJW,Roman Orientalism: Mapping Cultural Interactions through Latin Literature (Ist c.BCE - IInd cC. CE),Università degli studi di Napoli Federico II
2022PRHZJY,SICINState of Information and Communication between Italy and Northern Europe,Università di  PISA
2022PXTYCL,M.A.R.E: Manuscripts and books from Asia Reaching Europe. A semanticallyenhanced digital library mapping Asian books circulation along the silk Maritime Routes.,Università di  PISA
2022PYXKPT,WInGS. Women Intellectuals in Greek Society,Università degli studi di MILANO
2022PZYKER,From Unconventional* Households to Unconventional Affordable Housing,Università degli studi di TRIESTE
2022PcRLJ9,"Vitruvius De Architectura in the Classical and in the Early Modern Age. Philology,Archaeology, Digital Library, and 3D Modelling",Università degli studi di BOLOGNA
2022R2WHF,Survey and digitization of spectacle sources. Identity patterns and socio-culturalexchanges in the migration of Italian artists to the United States (1850-1930),Università degli studi di BERGAMO
2022R2ZJs2,NEREIDE - NEw Reading Experiences In the Digital Ecosystem,Università degli studi ROMATRE
2022R43s2A,WOmen Writing around the camera (WoW),Università degli studi di SASSARI
2022R4PYH3,"Marco Polo - from Venice to World Literatures (MarVeLs). Textual, inguistic, andsocio-cultural factors in the spreading of Devisement dou monde through space and time(13th-16th centuries).",Università Ca' FoscariVENEZIA
2022R7NKFZ,Womens Writings and national identity,Università degli Studi di FOGGIA
2022RBB99R,Letters for the arts: Farnese art patronage through correspondence (1534-1589).,Università degli studi della TUSCIA
2022RFC5ZR,The Dante Ancient Commentaries Corpus (CoDA). Digital Tools for Lexicographyand Exegesis of the Commedia.,Università degli studi di Napoli Federico II
2022RHCY5P,Knowledge of Things: Reassessing the Indigenous American Heritage in Italy(KNOT),Università degli studi di ROMA La Sapienza
2022RMYM9L,"Reuse, reworking and repurposing of Medieval Sculpture in the Modern Age:material evidence, historical research and new technologies",Università degli studi di TRENTO
2022SA97FP,"Early Modern Spanish Theater (1570 - 1700): textual transmission, europeancirculation, new digital resources",Università degli Studi ROMATRE
2022SLEC3C,TOMMASEO PAPERS ONLINE,Università degli studi di FIRENZE
2022SW5X3C,INTEGRATION_INTEllectual miGRATION: circulation of philosophical books and ideas around the ancient Mediterranean through the evidence of Graeco-Roman papyri.,Università degli Studi di FIRENZE
2022T7L8HK,Teaching Literature: a Field of Research,Università degli Studi di SIENA
2022T9sCN8,"From the Pen to the Type-sort. A Renaissance Mass-media Revolution, 1465-1515",Università Cattolica delSacro Cuore
2022TBN35M,Web-based Textual Corpus of Central-Italian Dialects (CorTIM),Università degli studi G.d'AnnunzioCHIETI-PESCARA
