codice,progetto,istituzione
2022THKLFF,GO-IN!diGital platfOrm for INner areas.Interactive virtual platforms for the enhancement of fragile contexts and their cultural heritage.,Università degli Studi di PAVIA
2022TM7WEJ,Collectives at the table - COLTA,Università degli studi di PALERMO
2022TNP3K8,"Diplomacy, Rhetoric and Pragmatism. A Study on Greek Acts and Privileges issuedby the Byzantine Emperors to the Italian Mercantile Cities (AD 1100-1400)",Università degli studi di BOLOGNA
2022TWKJTR,Theatre Festivals between Local and Global. Rethinking Theatre and Performance in Italy from the 1950s to the 1970s,Università degli studi di ROMA Tor Vergata
2022W2cBXS,MUSE. MUSical Ecosystems of Ancient Northern Italy (X B.C.-VIl C.E.),Università degli studi di PADOVA
2022W33NXT,Kanon: Epicurus Epistemology and Its Roots,Università degli studi di ROMA La Sapienza
2022W8FAHM,"Dicendo discitur. Assessing the educational value of declamation, from early imperial age to current times",Università degli studi di GENOVA
2022W8WYYJ,"Claudio Magris, European Intellectual: Archival Survey, Critical Study andEnhancement of the Collection at the Archivio Bonsanti (Florence)",Università degli studi di FIRENZE
2022WA2Y3Y,Schopenhauers Impact. The Schopenhauer-Schule and nocturnal humanism(Schop-Act),Università del SALENTO
2022WAPW5X,"Renegotiating Europes indentities. Trans-integrations, cross-roads and bordes inEast-Central Europe.",Università degli Studi di TORINO
2022WZT75F,INSITE - INTEGRATED SHARED KNOWLEDGE: FROM GEO-PALEONTOLOGICAL HERITAGE TO PRESENT TERRITORIAL CHALLENGES,Università degli studi di Napoli Federico II
2022WsBEE9,Dear Linder.: histories of texts and editions in the ALl-Erich Linder archive,Università degli studi di PADOVA
2022WsxJc5,"The mask between rituality and theatre. Archaeological, iterary, historical,anthropological, and performative investigation of material culture in the classical world throughDigital Humanities tools with a view to a broader, fairer and more inclusive cultural fruition.",Università degli studi di Urbino Carlo Bo
2022WxWwMC,The multisensory and interactional nature of music experience. Mergingaesthetics with bioengineering to investigate the multidimensional structure of musical sound.,Università degli studi di VERONA
2022X5B4EM,MediArsI - Interlacing Medieval Art in Southern Italy from the Normans to theHohenstaufen (11th-13th century),Università degli studi di BARI ALDO MORO
2022XJ8cxs,Display: the presence of futureAn archive/laboratory of the immaterial heritage of architectural exhibitions,Università degli studi di CAMERINO
2022XRFSXR,The French in/of Italy: Code-MixiNG in Medieval Europe (FrIngE Project),Università degli studi di PADOVA
2022XS25NZ,"Towards the History of a Heterodox Tradition in Analytic Philosophy:Transformative, Humanistic, Conversational",Università degli studi di ROMA La Sapienza
2022Y9s3H4,Textual Data and Tools for Coreference Resolution of Latin,Università Cattolica delSacro Cuore
2022YHNX9M,Dissonant Heritage and War. Conservation and Communication of a dificultlegacy- Co.Co. War,Università degli Studi di BOLOGNA
2022YNB8MR,"Entangled chronotopes: language, power, bodyscapes and religion in the first tenbooks of the Saunaka Atharvaveda-Samhita Šs.An overall reassessment (more than one century ater Whitneys magnum opus) of the Ss, in terms of its time-space coordinates within the Vedic cultural landscape,through a newly devised English (and Italian) translation of the verse and prose sections ofbooks I-X,adopted as a hermeneutical device to map language onto real and imaginary objects andinstitutions.",Università degli studi di CAGLIARI
2022YRSNNS,"WilDebate.Coexistences, Bio-cultural Frictions and Pastoralism in Protected Areas",Università degli studi delMOLISE
2022ZAH9HC,Manuscripta Italica Allographica (MIA). ltalo-Romance Texts Written in non-LatinCharacters from the Middle Ages to Modern Times,Università di  PISA
2022ZAKMJH,"Rome in the Nordic Countries. Images of ancient and modern architecture, 17th-19th century: diffusion, collections and functions in the development of a shared Europeanlanguage of Classicism",Università degli studi di ROMA La Sapienza
2022ZJ3PT9,"A Case of Minor History?Agency and dissent in Italian independent cinema, between art and counter-information,viewing modalities, and experimental film-format practices (1961-1976)",Università degli studi di UDINE
2022ZJ4N9E,NAPLES DANTE PROJECT,Università degli Studi di Napoli Federico II
2022ZT2NZJ,The Digital Encyclopedia of Boccaccios Decameron,Università degli Studi ROMATRE
2022c7KF8X,The Golden Age of talian Animation. From Economic Boom to the Years of Lead(1957-1977),Università degli Studi ROMATRE
2022cFA3L8,"Women, theatre, fascism",Università degli studi ROMATRE
2022cP88KY,"LIBMovIT - Libraries on the move: scholars, books, ideas traveling in Italy in the18th century",Università degli Studi di BOLOGNA
2022cWL4H2,PoetRi. Female poetry of the Renaissance.,Università degli studi ROMATRE
2022cYBW9R,"Performing Arts and Digital Humanities: a mapping of the dissemination of the Italian model of spectacle in the 18th century Europe. The migration of professionals, the circulation of spectacle practices and ideas of theatre at the roots of European identity.",Università degli studi di FIRENZE
2022czWWKP,Musical Metaverse: an inclusive Extended Reality platform for networkedmusical interactions,Università degli studi di TRENTO
2022kKWJ4sH,Mapping the history of subaltern literature in Southern Italy,Università della  CALABRIA
2022s3NCNT,"Open Science: Theoretical Presuppositions, Historical Developments andOperative Applications",Università degli Studi di SALERNO
2022s3Xzz5,From Post-Trauma to Ecology: Contemporary Gender Narratives in SIlavic CulturalTexts,Università del SALENTO
2022s5LET5,The textual legacy of the Ostrogoths in taly: The Bible version and other texts(Acronym: LegOst),Università degli studi di PERUGIA
2022sEK27B,Politics of Worship pre- and post-Reformation,Università degli studi di ROMA La Sapienza
2022sSEAZK,Representing Arcadia Before and After the Arcadia (1504-1790),Università degli Studi di PADOVA
2022sYRN27,ArDIRe. Digital archives and dictionary for the early artistic recipe books in theItalian Language (late 14th-16th century),Università degli Studi di TORINO
2022x78zKL,"Minor Italian poets of the XIVth century. A reconsideration of the historiographicalcanon by means of new editions, commentaries, archival research.",Università degli Studi di TRENTO
2022xLTAJK,"Literature and disability. Autobiographical writings and creative texts, betweenliterary critics, educational challenge and social impact",Università Cattolica delSacro Cuore
2022z39LJH,"Margaret of Austria, a Princess Emboldened by Arts at Courts Europe (PEACE)",Università degli Studi di TERAMO
2022z77zP2,Declinations of risk: for an archaeology of aesthetic and literary imaginaries from the twentieth century to the present day in French-language literature,Università degli studi di TORINO
2022zEATEY,MICHAEL - Multimedial Italian CHant ArchivE of Liturgical melodies and texts(14th-18th centuries),Università degli studi di TRENTO
2022zTEs8N,"Getting ready for the present: new global dystopian imaginaries and publicengagement. Transcultural and transmedial dialogues between Japanese, Latin American, Britishand Anglo American cultures.",Università degli studi di BOLOGNA
2022zs873Y,Letters on the net: Eugenio Montales correspondence (1915-1981). Study anddatabase,Università degli studi di SIENA
